{
  "ibex_ir": "grammar",
  "schema_version": 1,
  "class_name": "GoldenFixtureParser",
  "superclass": null,
  "start": "start",
  "expect": 0,
  "options": {
    "result_var": true,
    "omit_action_call": true
  },
  "symbols": [
    {
      "id": 0,
      "name": "$eof",
      "kind": "terminal",
      "reserved": true,
      "prec": null,
      "loc": null
    },
    {
      "id": 1,
      "name": "error",
      "kind": "terminal",
      "reserved": true,
      "prec": null,
      "loc": null
    },
    {
      "id": 2,
      "name": "NUMBER",
      "kind": "terminal",
      "reserved": false,
      "prec": null,
      "loc": {
        "file": "golden-v1.y",
        "line": 2,
        "column": 1
      }
    },
    {
      "id": 3,
      "name": "PLUS",
      "kind": "terminal",
      "reserved": false,
      "prec": {
        "associativity": "left",
        "level": 1
      },
      "loc": {
        "file": "golden-v1.y",
        "line": 2,
        "column": 1
      }
    },
    {
      "id": 4,
      "name": "start",
      "kind": "nonterminal",
      "reserved": false,
      "prec": null,
      "loc": {
        "file": "golden-v1.y",
        "line": 10,
        "column": 1
      }
    },
    {
      "id": 5,
      "name": "expression",
      "kind": "nonterminal",
      "reserved": false,
      "prec": null,
      "loc": {
        "file": "golden-v1.y",
        "line": 11,
        "column": 1
      }
    }
  ],
  "productions": [
    {
      "id": 0,
      "lhs": 4,
      "rhs": [
        5
      ],
      "action": null,
      "prec_override": null,
      "origin": {
        "kind": "user",
        "loc": {
          "file": "golden-v1.y",
          "line": 10,
          "column": 8
        }
      }
    },
    {
      "id": 1,
      "lhs": 5,
      "rhs": [
        5,
        3,
        2
      ],
      "action": {
        "code": " result = val[0] + val[2] ",
        "loc": {
          "file": "golden-v1.y",
          "line": 11,
          "column": 36
        },
        "named_refs": [],
        "context_length": 0
      },
      "prec_override": null,
      "origin": {
        "kind": "user",
        "loc": {
          "file": "golden-v1.y",
          "line": 11,
          "column": 13
        }
      }
    },
    {
      "id": 2,
      "lhs": 5,
      "rhs": [
        2
      ],
      "action": null,
      "prec_override": null,
      "origin": {
        "kind": "user",
        "loc": {
          "file": "golden-v1.y",
          "line": 12,
          "column": 13
        }
      }
    }
  ],
  "user_code": {
    "header": "",
    "inner": "def fixture_helper = true\n",
    "footer": ""
  },
  "conversions": {
    "NUMBER": "Integer"
  },
  "warnings": [],
  "user_code_chunks": {
    "inner": [
      {
        "code": "def fixture_helper = true\n",
        "loc": {
          "file": "golden-v1.y",
          "line": 15,
          "column": 1
        }
      }
    ]
  }
}
